,id,compendiumUrl,numPages,curatorApiUrl,GENERIC,SAMPLEID,MISSION,STATION,LANDMARK,BAGNUMBER,ORIGINALWEIGHT,SAMPLETYPE,SAMPLESUBTYPE,PRISTINITY,PRISTINITYDATE,HASTHINSECTION,HASDISPLAYSAMPLE,DISPLAYSAMPLENUMBER,GENERICDESCRIPTION
0,10003,https://www.lpi.usra.edu/lunar/samples/atlas/compendium/10003.pdf,10,https://curator.jsc.nasa.gov/rest/lunarapi/samples/sampledetails/10003,10003,4,Apollo 11,,,ALSRC 1004,213.0,Basalt,Ilmenite,65.562,"January, 26 2015 00:00:00",True,,,"low K, medium-grained, ophitic, few vugs, cristobalite"
1,10017,https://www.lpi.usra.edu/lunar/samples/atlas/compendium/10017.pdf,14,https://curator.jsc.nasa.gov/rest/lunarapi/samples/sampledetails/10017,10017,10,Apollo 11,,,ALSRC 1004,973.0,Basalt,Ilmenite,43.711,"March, 03 2015 00:00:00",True,True,"10017,37","high K, fine-grained, olivine, few vesicles and vugs"
2,10020,https://www.lpi.usra.edu/lunar/samples/atlas/compendium/10020.pdf,9,https://curator.jsc.nasa.gov/rest/lunarapi/samples/sampledetails/10020,10020,13,Apollo 11,,,ALSRC 1004,425.0,Basalt,Ilmenite,27.881,"February, 19 2015 00:00:00",True,True,"10020,57","low K, fine-grained, subophitic to intergranular, moderate vesicles & vugs, cristobalite, large olivine"
3,10022,https://www.lpi.usra.edu/lunar/samples/atlas/compendium/10022.pdf,5,https://curator.jsc.nasa.gov/rest/lunarapi/samples/sampledetails/10022,10022,15,Apollo 11,,,Cont.  Bag,95.59,Basalt,Ilmenite,42.19,"December, 03 2014 00:00:00",True,,,"high K, fine-grained, subophitic, many large vesicles"
4,10024,https://www.lpi.usra.edu/lunar/samples/atlas/compendium/10024.pdf,5,https://curator.jsc.nasa.gov/rest/lunarapi/samples/sampledetails/10024,10024,17,Apollo 11,,,Cont.  Bag,68.12,Basalt,Ilmenite,40.057,"December, 03 2014 00:00:00",True,,,"high K, medium-grained, intergranular, few vugs"
5,10029,https://www.lpi.usra.edu/lunar/samples/atlas/compendium/10029.pdf,4,https://curator.jsc.nasa.gov/rest/lunarapi/samples/sampledetails/10029,10029,22,Apollo 11,,,Cont.  Bag,5.53,Basalt,Ilmenite,0.0,"December, 03 2014 00:00:00",True,,,"low K, medium-grained, ophitic, olivine in pyroxene"
6,10031,https://www.lpi.usra.edu/lunar/samples/atlas/compendium/10031.pdf,3,https://curator.jsc.nasa.gov/rest/lunarapi/samples/sampledetails/10031,10031,24,Apollo 11,,,Cont.  Bag,2.7,Basalt,Ilmenite,90.741,"September, 03 2014 00:00:00",True,,,"high K, vitrophyre, fine-grained to glassy groundmass, olivine & armalcolite w/ ilmenite phenocrysts"
7,10032,https://www.lpi.usra.edu/lunar/samples/atlas/compendium/10032.pdf,3,https://curator.jsc.nasa.gov/rest/lunarapi/samples/sampledetails/10032,10032,25,Apollo 11,,,Cont.  Bag,3.13,Basalt,Ilmenite,0.0,"December, 03 2014 00:00:00",True,,,"high K, fine-grained, sl vesicles, olivine, pigeonite to augite, anorthositic"
8,10044,https://www.lpi.usra.edu/lunar/samples/atlas/compendium/10044.pdf,10,https://curator.jsc.nasa.gov/rest/lunarapi/samples/sampledetails/10044,10044,26,Apollo 11,,,ALSRC 1003,247.5,Basalt,Cristobalite,50.43,"December, 03 2014 00:00:00",True,,,"low K, medium-grained, ophitic, vugs, cristobalite"
9,10045,https://www.lpi.usra.edu/lunar/samples/atlas/compendium/10045.pdf,7,https://curator.jsc.nasa.gov/rest/lunarapi/samples/sampledetails/10045,10045,27,Apollo 11,,,ALSRC 1003,185.0,Basalt,Olivine,12.126,"December, 03 2014 00:00:00",True,True,"10045,19","low K, fine-grained, ophitic, few vugs, few vesicles, olivine, pyroxene, anorthite, ilmenite"
10,10047,https://www.lpi.usra.edu/lunar/samples/atlas/compendium/10047.pdf,8,https://curator.jsc.nasa.gov/rest/lunarapi/samples/sampledetails/10047,10047,29,Apollo 11,,,ALSRC 1003,138.0,Basalt,Ilmenite,33.493,"December, 03 2014 00:00:00",True,True,,"low K, medium-grained, ophitic, few vugs, olivine in pyroxene"
11,10049,https://www.lpi.usra.edu/lunar/samples/atlas/compendium/10049.pdf,7,https://curator.jsc.nasa.gov/rest/lunarapi/samples/sampledetails/10049,10049,31,Apollo 11,,,ALSRC 1003,193.0,Basalt,Ilmenite,70.134,"December, 03 2014 00:00:00",True,,,"high K, very fine-grained, intergranular, vesicular to vuggy, pyroxene, anorthositic, ilmenite"
12,10050,https://www.lpi.usra.edu/lunar/samples/atlas/compendium/10050.pdf,7,https://curator.jsc.nasa.gov/rest/lunarapi/samples/sampledetails/10050,10050,32,Apollo 11,,,ALSRC 1003,114.5,Basalt,Ilmenite,49.052,"September, 19 2014 00:00:00",True,,,"low K, medium-grained, subophitic to ophitic, vesicular to vuggy, microgabbro, olivine, pyroxene, anorthositic, ilmenite, cristobalite, xenoliths"
13,10057,https://www.lpi.usra.edu/lunar/samples/atlas/compendium/10057.pdf,11,https://curator.jsc.nasa.gov/rest/lunarapi/samples/sampledetails/10057,10057,34,Apollo 11,,,ALSRC 1003,919.0,Basalt,Ilmenite,35.145,"March, 03 2015 00:00:00",True,True,,"high K, subophitic to intergranular, many vesicles, pyroxene, anorthositic, ilmenite, cristobalite"
14,10058,https://www.lpi.usra.edu/lunar/samples/atlas/compendium/10058.pdf,8,https://curator.jsc.nasa.gov/rest/lunarapi/samples/sampledetails/10058,10058,35,Apollo 11,,,ALSRC 1003,282.0,Basalt,Ilmenite,87.947,"November, 26 2014 00:00:00",True,,,"low K, medium-grained, ophitic, few vugs, olivine in pyroxene, pyroxene, ilmenite, anorthite, cristobalite"
15,10062,https://www.lpi.usra.edu/lunar/samples/atlas/compendium/10062.pdf,7,https://curator.jsc.nasa.gov/rest/lunarapi/samples/sampledetails/10062,10062,40,Apollo 11,,,ALSRC 1004,78.5,Basalt,Ilmenite,35.073,"December, 03 2014 00:00:00",True,,,"low K, medium-grained, ophitic, few vugs, olivine, pyroxene, anorthositic, cristobalite"
16,10069,https://www.lpi.usra.edu/lunar/samples/atlas/compendium/10069.pdf,6,https://curator.jsc.nasa.gov/rest/lunarapi/samples/sampledetails/10069,10069,47,Apollo 11,,,ALSRC 1004,119.5,Basalt,Ilmenite,61.09,"December, 03 2014 00:00:00",True,,,"high K, very fine-grained, intergranular, vesicles, pyroxene, anorthositic, ilmenite"
17,10071,https://www.lpi.usra.edu/lunar/samples/atlas/compendium/10071.pdf,7,https://curator.jsc.nasa.gov/rest/lunarapi/samples/sampledetails/10071,10071,49,Apollo 11,,,ALSRC 1004,189.5,Basalt,Ilmenite,68.016,"January, 26 2015 00:00:00",True,,,"high K, fine-grained, intergranular, large vesicles, olivine in pyroxene, pyroxene, anorthositic, armalcolite"
18,10072,https://www.lpi.usra.edu/lunar/samples/atlas/compendium/10072.pdf,8,https://curator.jsc.nasa.gov/rest/lunarapi/samples/sampledetails/10072,10072,50,Apollo 11,,,ALSRC 1004,447.0,Basalt,Ilmenite,15.215,"November, 20 2014 00:00:00",True,True,"10072,80","high K, fine-grained, subophitic, large vesicles, olivine, pyroxene, cristobalite, armalcolite, plagioclase, ilmenite"
19,10092,https://www.lpi.usra.edu/lunar/samples/atlas/compendium/10092.pdf,3,https://curator.jsc.nasa.gov/rest/lunarapi/samples/sampledetails/10092,10092,60,Apollo 11,,,ALSRC 1003,46.0,Basalt,Ilmenite,83.92,"December, 03 2014 00:00:00",True,,,"low K, intergranular, large vesicles to vuggy, olivine, pyroxene, anorthite, ilmenite, cristobalite"
20,12002,https://www.lpi.usra.edu/lunar/samples/atlas/compendium/12002.pdf,15,https://curator.jsc.nasa.gov/rest/lunarapi/samples/sampledetails/12002,12002,,Apollo 12,,,,1530.0,Basalt,Olivine,49.042,"March, 11 2015 00:00:00",True,,,"C, medium-grained, few vesicles & vugs, ilmenite, chromite, ulvospinel, porphyritic olivine, radiate matrix"
21,12004,https://www.lpi.usra.edu/lunar/samples/atlas/compendium/12004.pdf,10,https://curator.jsc.nasa.gov/rest/lunarapi/samples/sampledetails/12004,12004,,Apollo 12,,MIDDLE CRESCENT CRATER,,585.0,Basalt,Olivine,85.528,"January, 21 2015 00:00:00",True,,,"C, medium-grained, few vesicles & vugs, ilmenite, chromite, ulvospinel, silica, porphyritic olivine, radiate matrix"
22,12005,https://www.lpi.usra.edu/lunar/samples/atlas/compendium/12005.pdf,5,https://curator.jsc.nasa.gov/rest/lunarapi/samples/sampledetails/12005,12005,,Apollo 12,,,,482.0,Basalt,Ilmenite,88.305,"March, 11 2015 00:00:00",True,False,,"C, medium to coarse-grained, none to very few vesicles & vugs, pyroxene, enclosed embayed olivine, ilmenite, chromite, ulvospinel, variable, highest Mg/Fe"
23,12006,https://www.lpi.usra.edu/lunar/samples/atlas/compendium/12006.pdf,4,https://curator.jsc.nasa.gov/rest/lunarapi/samples/sampledetails/12006,12006,,Apollo 12,,,,206.4,Basalt,Olivine,0.527,"November, 20 2014 00:00:00",True,True,"12006,1","C, medium-grained, few vugs, ilmenite, chromite, ulvospinel, subophitic, radiating feldspar laths"
24,12007,https://www.lpi.usra.edu/lunar/samples/atlas/compendium/12007.pdf,3,https://curator.jsc.nasa.gov/rest/lunarapi/samples/sampledetails/12007,12007,,Apollo 12,,,,65.2,Basalt,Pigeonite,72.719,"April, 16 2014 00:00:00",True,,,"C, medium-grained, few vugs, ilmenite, chromite, ulvospinel, silica, porphyritic pigeonite, ophitic to radiate matrix"
25,12008,https://www.lpi.usra.edu/lunar/samples/atlas/compendium/12008.pdf,5,https://curator.jsc.nasa.gov/rest/lunarapi/samples/sampledetails/12008,12008,,Apollo 12,,,,58.4,Basalt,Ilmenite,57.711,"January, 13 2015 00:00:00",True,,,"C, fine-grained, no vesicles & vugs, ilmenite, chromite, ulvospinel, silica, olivine porphyritic, very fine-grained to glassy matrix"
26,12009,https://www.lpi.usra.edu/lunar/samples/atlas/compendium/12009.pdf,7,https://curator.jsc.nasa.gov/rest/lunarapi/samples/sampledetails/12009,12009,,Apollo 12,,,,468.2,Basalt,Olivine,88.431,"March, 04 2015 00:00:00",True,,,"C, fine-grained, 1 large vesicle, ilmenite, chromite, ulvospinel, vitrophyre, skeleton olivine phenocrysts in spherulite matrix"
27,12011,https://www.lpi.usra.edu/lunar/samples/atlas/compendium/12011.pdf,4,https://curator.jsc.nasa.gov/rest/lunarapi/samples/sampledetails/12011,12011,,Apollo 12,,,,193.0,Basalt,Pigeonite,93.492,"January, 20 2015 00:00:00",True,,,"C, medium-grained, rare vugs, ilmenite, chromite, silica, olivine & pigeonite phenocrysts, fine-grained radiate groundmass"
28,12012,https://www.lpi.usra.edu/lunar/samples/atlas/compendium/12012.pdf,4,https://curator.jsc.nasa.gov/rest/lunarapi/samples/sampledetails/12012,12012,,Apollo 12,,,,176.2,Basalt,Olivine,91.922,"April, 16 2014 00:00:00",True,,,"C, medium-grained, no vesicles & vugs, ilmenite, chromite, silica, olivine porphyritic, subophitic groundmass"
29,12014,https://www.lpi.usra.edu/lunar/samples/atlas/compendium/12014.pdf,4,https://curator.jsc.nasa.gov/rest/lunarapi/samples/sampledetails/12014,12014,,Apollo 12,,,,159.4,Basalt,Olivine,91.176,"September, 19 2014 00:00:00",True,,,"C, fine-grained, no vesicles & vugs, ilmenite, chromite, silica, olivine porphyritic, subophitic groundmass"
30,12015,https://www.lpi.usra.edu/lunar/samples/atlas/compendium/12015.pdf,4,https://curator.jsc.nasa.gov/rest/lunarapi/samples/sampledetails/12015,12015,,Apollo 12,,MIDDLE CRESCENT CRATER,,191.2,Basalt,Olivine,93.524,"September, 25 2014 00:00:00",True,,,"C, fine-grained, 1 large vesicle, ilmenite, chromite, ulvospinel, vitrophyre with olivine phenocrysts"
31,12016,https://www.lpi.usra.edu/lunar/samples/atlas/compendium/12016.pdf,3,https://curator.jsc.nasa.gov/rest/lunarapi/samples/sampledetails/12016,12016,,Apollo 12,,,,2028.0,Basalt,Ilmenite,100.076,"December, 03 2014 00:00:00",True,,,"C, medium-grained, few vesicles & vugs, olivine, ulvospinel, ilmenite, Fe metal, intersertal to subophitic, cryptocrystalline matrix"
32,12017,https://www.lpi.usra.edu/lunar/samples/atlas/compendium/12017.pdf,8,https://curator.jsc.nasa.gov/rest/lunarapi/samples/sampledetails/12017,12017,,Apollo 12,,,,53.0,Basalt,Pigeonite,62.445,"December, 03 2014 00:00:00",True,,,"C, medium-grained, no vesicles & vugs, ilmenite, chromite, ulvospinel, silica, pigeonite phenocrysts, radiate to subophitic groundmass"
33,12018,https://www.lpi.usra.edu/lunar/samples/atlas/compendium/12018.pdf,9,https://curator.jsc.nasa.gov/rest/lunarapi/samples/sampledetails/12018,12018,,Apollo 12,,,,787.0,Basalt,Olivine,57.045,"March, 04 2015 00:00:00",True,True,"12018,13","C, medium-grained, rare vugs, ilmenite, chromite, ulvospinel, silica, large olivine and pyroxene in radiate matrix"
34,12019,https://www.lpi.usra.edu/lunar/samples/atlas/compendium/12019.pdf,4,https://curator.jsc.nasa.gov/rest/lunarapi/samples/sampledetails/12019,12019,,Apollo 12,,,,462.4,Basalt,Pigeonite,97.139,"December, 03 2014 00:00:00",True,,,"C, medium-grained, few vesicles, skeleton olivine, ilmenite, Cr-spinel, ulvospinel, Fe metal, abundant small pigeonite phenocrysts, radiate to subophitic groundmass"
35,12020,https://www.lpi.usra.edu/lunar/samples/atlas/compendium/12020.pdf,8,https://curator.jsc.nasa.gov/rest/lunarapi/samples/sampledetails/12020,12020,,Apollo 12,,,,312.0,Basalt,Olivine,76.654,"September, 04 2014 00:00:00",True,,,"C, medium-grained, few vugs, ilmenite, Cr-spinel, ulvospinel, silica, rounded olivine, elongated pyroxenite, radiate groundmass"
36,12021,https://www.lpi.usra.edu/lunar/samples/atlas/compendium/12021.pdf,12,https://curator.jsc.nasa.gov/rest/lunarapi/samples/sampledetails/12021,12021,,Apollo 12,,,,1877.0,Basalt,Pigeonite,85.775,"July, 15 2014 00:00:00",True,,,"C, few vugs, radiate groundmass, plagioclase, ilmenite, ilmenite, olivine, silica, elongated pigeonite phenocrysts"
37,12022,https://www.lpi.usra.edu/lunar/samples/atlas/compendium/12022.pdf,11,https://curator.jsc.nasa.gov/rest/lunarapi/samples/sampledetails/12022,12022,,Apollo 12,,,,1864.0,Basalt,Ilmenite,79.757,"January, 14 2015 00:00:00",True,True,"12022,92","C, medium-grained, few vugs, ilmenite, silica, porphyritic, olivine and pyroxene phenocrysts, radiate groundmass"
38,12031,https://www.lpi.usra.edu/lunar/samples/atlas/compendium/12031.pdf,5,https://curator.jsc.nasa.gov/rest/lunarapi/samples/sampledetails/12031,12031,,Apollo 12,,HEAD CRATER,Bag 3-D ,185.0,Basalt,Pigeonite,97.177,"September, 19 2014 00:00:00",True,,,"C, medium-grained, few vugs, ilmenite, tridymite, pyroxferroite, pyroxene-feldspar intergrowths, dendritic ilmenite"
39,12035,https://www.lpi.usra.edu/lunar/samples/atlas/compendium/12035.pdf,7,https://curator.jsc.nasa.gov/rest/lunarapi/samples/sampledetails/12035,12035,,Apollo 12,,BENCH CRATER,Bag 7-D ,71.0,Basalt,Olivine,48.544,"May, 27 2014 00:00:00",True,,,"C, medium to coarse-grained, many vugs, Cr-spinel, ilmenite, large olivine and pyroxene with poikilitic  plagioclase"
40,12036,https://www.lpi.usra.edu/lunar/samples/atlas/compendium/12036.pdf,4,https://curator.jsc.nasa.gov/rest/lunarapi/samples/sampledetails/12036,12036,,Apollo 12,,BENCH CRATER,Bag 8-D ,75.0,Basalt,Olivine,73.007,"September, 04 2014 00:00:00",True,,,"C, medium to coarse-grained, many vugs, high K, glass intersitital, K-spar, large olivine and pyroxene with poikilitic  plagioclase, very much like 12035"
41,12038,https://www.lpi.usra.edu/lunar/samples/atlas/compendium/12038.pdf,14,https://curator.jsc.nasa.gov/rest/lunarapi/samples/sampledetails/12038,12038,,Apollo 12,,BENCH CRATER,Bag 9-D ,746.0,Basalt,Feldspathic,80.5,"October, 15 2014 00:00:00",True,,,"C, medium-grained, many vugs, ilmenite, sris, chromite, Fe metal, fayalite, K-feldspar, intersertal to subophitic"
42,12039,https://www.lpi.usra.edu/lunar/samples/atlas/compendium/12039.pdf,6,https://curator.jsc.nasa.gov/rest/lunarapi/samples/sampledetails/12039,12039,,Apollo 12,,BENCH CRATER,Bag 10-D,255.0,Basalt,Pigeonite,90.374,"January, 20 2015 00:00:00",True,,,"C, medium-grained, few vugs, ilmenite, tridymite, cristobalite, Fe metal, pyroxene phenocrysts, subophitic matrix"
43,12040,https://www.lpi.usra.edu/lunar/samples/atlas/compendium/12040.pdf,8,https://curator.jsc.nasa.gov/rest/lunarapi/samples/sampledetails/12040,12040,,Apollo 12,,BENCH CRATER,Bag 10-D,319.0,Basalt,Olivine,71.111,"September, 04 2014 00:00:00",True,,,"C, medium-grained, few large vugs, ilmenite, chromite, ulvospinel, silica, small olivine, larger augite-pigeonite, elongated plagioclase"
44,12043,https://www.lpi.usra.edu/lunar/samples/atlas/compendium/12043.pdf,3,https://curator.jsc.nasa.gov/rest/lunarapi/samples/sampledetails/12043,12043,,Apollo 12,,SURVEYOR CRATER,Bag 14-D,60.0,Basalt,Pigeonite,94.825,"December, 03 2014 00:00:00",True,,,"C, medium-grained, few vesicles, ilmenite, chromite, ulvospinel, silica, pigeonite phenocrysts, subophitic to radiate groundmass"
45,12045,https://www.lpi.usra.edu/lunar/samples/atlas/compendium/12045.pdf,4,https://curator.jsc.nasa.gov/rest/lunarapi/samples/sampledetails/12045,12045,,Apollo 12,,BLOCK CRATER,Bag 15-D,63.0,Basalt,Ilmenite,83.91,"September, 25 2013 00:00:00",True,,,"C, fine-grained, vesicles & vugs, ilmenite, silica, troilite, Fe metal, olivine phenocrysts, radiate matrix"
46,12046,https://www.lpi.usra.edu/lunar/samples/atlas/compendium/12046.pdf,4,https://curator.jsc.nasa.gov/rest/lunarapi/samples/sampledetails/12046,12046,,Apollo 12,,BLOCK CRATER,Bag 15-D,166.0,Basalt,Ilmenite,96.586,"December, 03 2014 00:00:00",True,,,"C, medium-grained, few vesicles, olivine, chromite, ulvospinel, ilmenite, silica, ophitic to subophitic"
47,12047,https://www.lpi.usra.edu/lunar/samples/atlas/compendium/12047.pdf,5,https://curator.jsc.nasa.gov/rest/lunarapi/samples/sampledetails/12047,12047,,Apollo 12,,BLOCK CRATER,Bag 15-D,193.0,Basalt,Ilmenite,33.699,"December, 03 2014 00:00:00",True,True,"12047,6","C, medium-grained, few vesicles, ilmenite, silica, chromite, ulvospinel, subophitic, ilmenite and  feldspar laths"
48,12051,https://www.lpi.usra.edu/lunar/samples/atlas/compendium/12051.pdf,13,https://curator.jsc.nasa.gov/rest/lunarapi/samples/sampledetails/12051,12051,,Apollo 12,,SURVEYOR CRATER,,1660.0,Basalt,Ilmenite,87.534,"February, 12 2015 00:00:00",True,,,"C, medium-grained, few vesicles & vugs, ilmenite, silica, chromite, ulvospinel, pyroxene phenocrysts, intersertal to subophitic matrix"
49,12052,https://www.lpi.usra.edu/lunar/samples/atlas/compendium/12052.pdf,14,https://curator.jsc.nasa.gov/rest/lunarapi/samples/sampledetails/12052,12052,,Apollo 12,,HEAD CRATER,,1866.0,Basalt,Pigeonite,86.928,"December, 03 2014 00:00:00",True,,,"C, medium-grained, many vugs, ilmenite, chromite, ulvospinel, pyroxene  & olivine (few) phenocrysts, radiate groundmass"
50,12053,https://www.lpi.usra.edu/lunar/samples/atlas/compendium/12053.pdf,9,https://curator.jsc.nasa.gov/rest/lunarapi/samples/sampledetails/12053,12053,,Apollo 12,,BENCH CRATER,,879.0,Basalt,Pigeonite,46.433,"January, 13 2015 00:00:00",True,True,"12053,93","C, medium-grained, few vesicles, ilmenite, chromite, ulvospinel, rare silica, pyroxene & olivine phenocrysts, radiate groundmass"
51,12054,https://www.lpi.usra.edu/lunar/samples/atlas/compendium/12054.pdf,10,https://curator.jsc.nasa.gov/rest/lunarapi/samples/sampledetails/12054,12054,,Apollo 12,,SURVEYOR CRATER,,687.0,Basalt,Ilmenite,90.978,"January, 13 2015 00:00:00",True,,,"C, medium-grained, few vugs, maskelynite, ilmenite, chromite, ulvospinel, subophitic, equigranular, large glass splash coating"
52,12055,https://www.lpi.usra.edu/lunar/samples/atlas/compendium/12055.pdf,5,https://curator.jsc.nasa.gov/rest/lunarapi/samples/sampledetails/12055,12055,,Apollo 12,,HEAD CRATER,,912.0,Basalt,Pigeonite,26.002,"November, 20 2014 00:00:00",True,True,"12055,35; 12055,37; 12055,32","C, medium-grained, rare vesicles, ilmenite, chromite, ulvospinel, rare olivine and silica, porphyritic, pyroxene phenocrysts, radiate to subophitic groundmass"
53,12056,https://www.lpi.usra.edu/lunar/samples/atlas/compendium/12056.pdf,5,https://curator.jsc.nasa.gov/rest/lunarapi/samples/sampledetails/12056,12056,,Apollo 12,,SURVEYOR CRATER,,121.0,Basalt,Ilmenite,92.464,"January, 26 2015 00:00:00",True,,,"C, medium-grained, few vesicles, olivine, chromite, ulvospinel, ilmenite, silica, subophitic, equigranular, symplectite"
54,12061,https://www.lpi.usra.edu/lunar/samples/atlas/compendium/12061.pdf,3,https://curator.jsc.nasa.gov/rest/lunarapi/samples/sampledetails/12061,12061,,Apollo 12,,,,9.5,Basalt,Ilmenite,78.232,"April, 03 2014 00:00:00",True,,,"C, medium-grained, few vesicles, olivine, chromite, ulvospinel, ilmenite, silica, ophitic to subophitic, olivine cores in pyroxene"
55,12062,https://www.lpi.usra.edu/lunar/samples/atlas/compendium/12062.pdf,4,https://curator.jsc.nasa.gov/rest/lunarapi/samples/sampledetails/12062,12062,,Apollo 12,,SURVEYOR CRATER,,738.7,Basalt,Ilmenite,97.521,"December, 03 2014 00:00:00",True,,,"C, medium-grained, few vesicles, ilmenite, chromite, ulvospinel, rare silica, subophitic to ophitic"
56,12063,https://www.lpi.usra.edu/lunar/samples/atlas/compendium/12063.pdf,15,https://curator.jsc.nasa.gov/rest/lunarapi/samples/sampledetails/12063,12063,,Apollo 12,,BENCH CRATER,,2426.0,Basalt,Ilmenite,86.379,"January, 27 2015 00:00:00",True,,,"C, medium-grained, rare vesicles, ilmenite, chromite, ulvospinel, rare silica, porphyritic olivine and pyroxene, symplectite"
57,12064,https://www.lpi.usra.edu/lunar/samples/atlas/compendium/12064.pdf,10,https://curator.jsc.nasa.gov/rest/lunarapi/samples/sampledetails/12064,12064,,Apollo 12,,SURVEYOR CRATER,,1214.0,Basalt,Ilmenite,91.704,"March, 02 2015 00:00:00",True,,,"C, medium-grained, few vugs, ilmenite, chromite, ulvospinel, silica, subophitic to ophitic, intergrown pyroxene and plagioclase"
58,12065,https://www.lpi.usra.edu/lunar/samples/atlas/compendium/12065.pdf,11,https://curator.jsc.nasa.gov/rest/lunarapi/samples/sampledetails/12065,12065,,Apollo 12,,SURVEYOR CRATER,,2109.0,Basalt,Pigeonite,64.836,"December, 03 2014 00:00:00",True,True,"12065,15","C, fine to medium-grained, rare vugs, ilmenite, chromite, ulvospinel, silica, olivine and pyroxene phenocrysts, radiate matrix"
59,12072,https://www.lpi.usra.edu/lunar/samples/atlas/compendium/12072.pdf,4,https://curator.jsc.nasa.gov/rest/lunarapi/samples/sampledetails/12072,12072,,Apollo 12,,,,103.6,Basalt,Olivine,92.138,"February, 27 2014 00:00:00",True,,,"C, medium-grained, large vesicles & vugs, ilmenite, chromite, ulvospinel, silica, olivine and pyroxene phenocrysts, radiate matrix"
60,12075,https://www.lpi.usra.edu/lunar/samples/atlas/compendium/12075.pdf,6,https://curator.jsc.nasa.gov/rest/lunarapi/samples/sampledetails/12075,12075,,Apollo 12,,,,232.5,Basalt,Olivine,79.983,"March, 04 2015 00:00:00",True,,,"C, medium-grained, many vugs, ilmenite, chromite, ulvospinel, silica, olivine and pyroxene phenocrysts, radiate to intersertal matrix"
61,12076,https://www.lpi.usra.edu/lunar/samples/atlas/compendium/12076.pdf,3,https://curator.jsc.nasa.gov/rest/lunarapi/samples/sampledetails/12076,12076,,Apollo 12,,,,54.55,Basalt,Olivine,82.788,"March, 04 2015 00:00:00",True,,,"C, medium-grained, many vugs, ilmenite, chromite, ulvospinel, silica, olivine and pyroxene phenocrysts, radiate matrix"
62,12077,https://www.lpi.usra.edu/lunar/samples/atlas/compendium/12077.pdf,3,https://curator.jsc.nasa.gov/rest/lunarapi/samples/sampledetails/12077,12077,,Apollo 12,,,,22.63,Basalt,Olivine,87.936,"May, 14 2012 00:00:00",True,,,"C, fine-grained, few vugs, ilmenite, chromite, ulvospinel, porphyritic olivine in matrix of radiate plagioclase and ilmenite, friable"
63,14053,https://www.lpi.usra.edu/lunar/samples/atlas/compendium/14053.pdf,8,https://curator.jsc.nasa.gov/rest/lunarapi/samples/sampledetails/14053,14053,,Apollo 14,C2,CONE CRATER,14N,251.3,Basalt,Feldspathic,59.181,"October, 15 2014 00:00:00",True,,,
64,14071,https://www.lpi.usra.edu/lunar/samples/atlas/compendium/14071.pdf,2,https://curator.jsc.nasa.gov/rest/lunarapi/samples/sampledetails/14071,14071,,Apollo 14,C,CONE CRATER,10N,2.16,Basalt,Unclassified,79.167,"February, 24 2011 00:00:00",True,,,Crystalline
65,14072,https://www.lpi.usra.edu/lunar/samples/atlas/compendium/14072.pdf,7,https://curator.jsc.nasa.gov/rest/lunarapi/samples/sampledetails/14072,14072,,Apollo 14,C,CONE CRATER,10N,45.06,Basalt,Olivine,55.368,"February, 03 2015 00:00:00",True,,,
66,14073,https://www.lpi.usra.edu/lunar/samples/atlas/compendium/14073.pdf,4,https://curator.jsc.nasa.gov/rest/lunarapi/samples/sampledetails/14073,14073,,Apollo 14,G,NORTH TRIPLET RIM,20N,10.35,Basalt,KREEP,33.623,"February, 25 2014 00:00:00",True,,,Melt Rock. Collected from bottom of trench.
67,14074,https://www.lpi.usra.edu/lunar/samples/atlas/compendium/14074.pdf,0,https://curator.jsc.nasa.gov/rest/lunarapi/samples/sampledetails/14074,14074,,Apollo 14,G,NORTH TRIPLET RIM,20N,5.16,Basalt,Feldspathic,87.539,"December, 03 2014 00:00:00",True,,,Melt Rock. Collected from bottom of trench.
68,14077,https://www.lpi.usra.edu/lunar/samples/atlas/compendium/14077.pdf,0,https://curator.jsc.nasa.gov/rest/lunarapi/samples/sampledetails/14077,14077,,Apollo 14,G,NORTH TRIPLET RIM,20N,2.77,Basalt,Feldspathic,82.85,"August, 15 2007 00:00:00",True,,,Crystalline. Collected from bottom of trench.
69,14078,https://www.lpi.usra.edu/lunar/samples/atlas/compendium/14078.pdf,9,https://curator.jsc.nasa.gov/rest/lunarapi/samples/sampledetails/14078,14078,,Apollo 14,G,NORTH TRIPLET RIM,20N,8.3,Basalt,Feldspathic,86.12,"September, 19 2014 00:00:00",True,,,Melt Rock. Collected from bottom of trench.
70,14079,https://www.lpi.usra.edu/lunar/samples/atlas/compendium/14079.pdf,0,https://curator.jsc.nasa.gov/rest/lunarapi/samples/sampledetails/14079,14079,,Apollo 14,G,NORTH TRIPLET RIM,20N,3.17,Basalt,Feldspathic,92.713,"December, 02 2013 00:00:00",True,,,Melt Rock. Collected from bottom of trench.
71,14168,https://www.lpi.usra.edu/lunar/samples/atlas/compendium/14168.pdf,2,https://curator.jsc.nasa.gov/rest/lunarapi/samples/sampledetails/14168,14168,,Apollo 14,ALSEP,,Bag 1027,43.9,Soil,4-10 mm,75.697,"September, 19 2014 00:00:00",True,,,"Fines, 4-10mm"
72,14181,https://www.lpi.usra.edu/lunar/samples/atlas/compendium/14181.pdf,2,https://curator.jsc.nasa.gov/rest/lunarapi/samples/sampledetails/14181,14181,,Apollo 14,ALSEP,,Bag 1027,2.48,Breccia,Fragmental,88.185,"September, 22 2014 00:00:00",True,,,Troctolitic. Part of comprehensive sample.
73,14276,https://www.lpi.usra.edu/lunar/samples/atlas/compendium/14276.pdf,5,https://curator.jsc.nasa.gov/rest/lunarapi/samples/sampledetails/14276,14276,,Apollo 14,ALSEP,,Bag 1039,12.75,Breccia,Impact Melt,23.286,"September, 19 2014 00:00:00",True,,,Basalt?
